date,city,permit_type,permit_number,address,description
2025-12-02T00:00:00.000,Austin,Electrical Permit,2025-150739 EP,6300 E US 290 HWY SVRD WB,LOCATION 3) Remove & discard existing channel letters.  Install new set of internally illuminated LED channel letters on raceway to read ¿extended STAY AMERICA select suites¿ on side elevation = 4 x 14.73 = 58.92 SF.
2025-12-02T00:00:00.000,Austin,Plumbing Permit,2025-152553 PP,2201 AIRPORT BLVD UNIT 120,Interior Build-Out of a New Animal Clinic for Small Animals Within an Existing One-Story Shell Building
2025-12-02T00:00:00.000,Austin,Building Permit,2025-017154 BP,5505 WILLIAM HOLLAND AVE,Total demo of SFR SqFt circa 1955 and detached dwelling unit circa 1955 total demo SqFt 2901  ***The building shall not be demolished until after the contractor has fulfilled the neighbor notification requirements outlined in Steps 5 & 6 of the Demolition webpage. ***
2025-12-02T00:00:00.000,Austin,Plumbing Permit,2025-151776 PP,8003 MEAD PARKE CV,Replacement of an existing water heater Standard 40 Gal Natural Gas water heater change out   8003 Mead Parke Cove Austin TX 78726
2025-12-02T00:00:00.000,Austin,Building Permit,2025-151217 BP,503 E MARY ST BLDG 2,new in ground pool with autofill/heating system
2025-12-02T00:00:00.000,Austin,Plumbing Permit,2025-151753 PP,4521 AVENUE D,Cap off water and wastewater
2025-12-02T00:00:00.000,Austin,Building Permit,2025-152725 BP,301 ANGEL OAK ST,EXPRESS: Existing foundation repair as per scope of work attached
2025-12-02T00:00:00.000,Austin,Electrical Permit,2025-145764 EP,8119 TWO COVES DR,Installation of (2) Level 2 EV Chargers. Potential shutdown needed as well.
2025-12-02T00:00:00.000,Austin,Mechanical Permit,2025-119711 MP,4415 GILLIS ST BLDG 3,Bldg 3: New construction of a 3-Story Single Family Res. [4 bed 4 bath] with Attached 1-car Carport and Pool. Part of 3-unit use.
2025-12-02T00:00:00.000,Austin,Plumbing Permit,2025-151578 PP,7221 MOON ROCK RD,Replacement of an existing water heater
2025-12-02T00:00:00.000,Austin,Electrical Permit,2025-151436 EP,2324 S LAMAR BLVD,Install one wall sign for SKIN PARLOR
2025-12-02T00:00:00.000,Austin,Plumbing Permit,2024-087028 PP,2707 WOOLDRIDGE DR,Remodel scope of work to include refinishing interiors interior remodel with relocation of some interior walls sitting area adjacent to the living room to be lowered to match the same floor level.
2025-12-02T00:00:00.000,Austin,Plumbing Permit,2025-151577 PP,12020 SPRINGS HEAD LOOP,Replacement of an existing water heater
2025-12-02T00:00:00.000,Austin,Electrical Permit,2025-123128 EP,1808 SYLVAN DR BLDG 3,ePlan: Residential Expedited Review - New construction of a 3-Story Single Family Res. [3bed 3.5bath]. Bldg 3
2025-12-02T00:00:00.000,Austin,Building Permit,2025-153104 BP,10251 MISSEL THRUSH DR,EXPRESS: Install 11 push piers
2025-12-02T00:00:00.000,Austin,Plumbing Permit,2025-147394 PP,1600 SANCHEZ ST,Replace hot and cold water lines for bathroom kitchen and laundry. Cut 1 14x14 holes in 2 different walls. The rest will be ran through the attic. Under 100ft total.
2025-12-02T00:00:00.000,Austin,Mechanical Permit,2025-150510 MP,1111 PERRY RD,Replacement of complete existing central heat and air system with or without duct work LIKE FOR LIKE: 2 Ton Horizontal Gas System
2025-12-02T00:00:00.000,Austin,Electrical Permit,2025-123126 EP,1808 SYLVAN DR BLDG 1,ePlan: Residential Expedited Review - New construction of a 3-Story Single Family Res. [4bed 4bath] with Attached Carport. Bldg 1
2025-12-02T00:00:00.000,Austin,Electrical Permit,2025-150797 EP,12901 SCHLEICHER TRL,Furnish and install new 200a main breaker panel and new 200a meter base - Demo of existing aged equipment
2025-12-02T00:00:00.000,Austin,Plumbing Permit,2025-064222 PP,12733 TESLA RD,10 gas line cut in 10 valves in BIW main building
2025-12-02T00:00:00.000,Austin,Plumbing Permit,2025-116206 PP,211 WALTER SEAHOLM DR UNIT LR115,ePlan: Commercial Expedited Review - Remodel of restaurant space (67302 SF)
2025-12-02T00:00:00.000,Austin,Mechanical Permit,2025-152093 MP,4307 FLAGSTAFF DR,Replacement of complete existing central heat and air system with or without duct work LIKE FOR LIKE: 4 Ton Gas Vertical System
2025-12-02T00:00:00.000,Austin,Mechanical Permit,2025-119709 MP,4415 GILLIS ST BLDG 1,Bldg 1: New construction of a 2-Story Single Family Res. [3 bed 2.5 bath] with Attached 1-car carport.  Part of 3-unit use.
2025-12-02T00:00:00.000,Austin,Electrical Permit,2025-141696 EP,8113 WILDER RD UNIT 101,ePlan: Residential Expedited Review - SITE PLAN APPROVED: PHASE A - Greystar Plan A581 New 2 story attached unit with 3 bedrooms 2.5 bathrooms and a 2 car garage.
2025-12-02T00:00:00.000,Austin,Electrical Permit,2025-150723 EP,4808 WOODVIEW AVE,T-Pole for construction of a 2-Story Single Family Res.
2025-12-02T00:00:00.000,Austin,Electrical Permit,2025-150145 EP,1313 SPYGLASS DR,(Cooper Jon) - INSTALLATION OF CIRCUIT FOR ELEC. VEHICLE CHARGING STATION - ESIP
2025-12-02T00:00:00.000,Austin,Mechanical Permit,2025-146398 MP,5219 MONARDA MINT DR,Coolidge 1027-K-R New 2-Story Single Family Residence with (4) bedrooms (3) bathrooms Attached Garage Covered Patio & Porch Cafe & Loft
2025-12-02T00:00:00.000,Austin,Building Permit,2025-153188 BP,12921 STAYWELL WAY,2708BL NEW 2 STORY 5 BEDROOM 3 1/2 BATH SINGLE FAMILY RESIDENTIAL HOME WITH ATTACHED GARAGE COVERED FRONT PORCH AND REAR PATIO
2025-12-02T00:00:00.000,Austin,Mechanical Permit,2025-142741 MP,4711 BANDERA RD,Interior Remodel - Add HVAC system and ductwork. Frame and repair in the associated areas. Refer to SOW in BP 2025-036829
2025-12-02T00:00:00.000,Austin,Mechanical Permit,2025-149883 MP,9120 BURNET RD UNIT 110,ePlan: Commercial Expedited Review - Interior Remodel to Existing Office/Warehouse. Work to include subdividing Existing Interior into Multiple Suites and New Overhead Doors at Warehouse (29365 SF)
2025-12-02T00:00:00.000,Austin,Mechanical Permit,2025-151665 MP,2911 GREENLEE DR,Replacement of complete existing central heat and air system with or without duct work
2025-12-02T00:00:00.000,Austin,Building Permit,2025-152981 BP,11700 GAELIC DR,EXPRESS: Replace windows 8x Replace water heater
2025-12-02T00:00:00.000,Austin,Plumbing Permit,2025-151772 PP,10703 WATCHFUL FOX DR,Replacement of an existing water heater Standard 40 Gal Natural Gas water heater change out   10703 Watchful Fox Drive Austin TX 78748
2025-12-02T00:00:00.000,Austin,Plumbing Permit,2025-137108 PP,12733 TESLA RD,700 of 1 1/2 gas pipe. CASTING V-X2.8 - 4.8 LV1
2025-12-02T00:00:00.000,Austin,Plumbing Permit,2025-146777 PP,2111 PARAMOUNT AVE,Total demo of 1662 SFR circa 1963
2025-12-02T00:00:00.000,Austin,Electrical Permit,2025-150730 EP,13304 UNDERBANK RD,Homebuilder Loop Austin 2 Mile ETJ Austin Energy
2025-12-02T00:00:00.000,Austin,Driveway / Sidewalks,2025-042077 DS,1508 ALGUNO RD,Construct new driveway approach 12.04 FT.  Fee in lieu of sidewalk paid.   SFIL attached to 2025-009224 PR
2025-12-02T00:00:00.000,Austin,Electrical Permit,2025-151480 EP,6011 CARY DR,Free standing meter loop for permanent service
2025-12-02T00:00:00.000,Austin,Plumbing Permit,2025-149423 PP,9012 COLLINFIELD DR,Tunnel under the foundation to replace the cast iron in the bathroom kitchen and laundry with SCH 40 PVC. There will be (2-3) access holes on the front right and left sides of the house
2025-12-02T00:00:00.000,Austin,Plumbing Permit,2025-113361 PP,7104 OTHELLO CV,New pool spa and concrete deck
2025-12-02T00:00:00.000,Austin,Building Permit,2025-150553 BP,7507 VAIL VALLEY DR,Express: walk-in shower replacement replace HVAC
2025-12-02T00:00:00.000,Austin,Electrical Permit,2025-150171 EP,3523 STONERIDGE RD,Moving existing service to a rack. - AUSTIN LTD
2025-12-02T00:00:00.000,Austin,Plumbing Permit,2025-148949 PP,1178 GRAHAM ST,express - replace front door same size convert tub to a walk-in shower replace HVAC system replace water heater
2025-12-02T00:00:00.000,Austin,Electrical Permit,2025-026061 EP,8800 N IH 35 SVRD SB BLDG 12,Proposed rebuild of Fire Damaged Apartments. Units 2090 2091 3090 3091 & 3092
2025-12-02T00:00:00.000,Austin,Electrical Permit,2025-150683 EP,9400 OXBOW STRAP DR,temporary tpole for new construction for Wildhorse
2025-12-02T00:00:00.000,Austin,Mechanical Permit,2025-152219 MP,13425 SEA BISCUIT DR,Replacement of complete existing central heat and air system with or without duct work
2025-12-02T00:00:00.000,Austin,Electrical Permit,2025-150973 EP,9012 BINNEWATER WAY,Homebuilders loop for New SFR ref 2025-144128 BP. Austin LTD -Bluebonnet
2025-12-02T00:00:00.000,Austin,Mechanical Permit,2025-149885 MP,9120 BURNET RD UNIT 150,ePlan: Commercial Expedited Review - Interior Remodel to Existing Office/Warehouse. Work to include subdividing Existing Interior into Multiple Suites and New Overhead Doors at Warehouse (29365 SF)
2025-12-02T00:00:00.000,Austin,Electrical Permit,2025-150933 EP,8113 WILDER RD UNIT 102,Homebuilders loop for New SFR ref 2025-134374 BP. Austin Full purpose
2025-12-02T00:00:00.000,Austin,Electrical Permit,2025-151208 EP,2604 DERWENT DR,Homebuilder Loop Austin 2 Mile ETJ Austin Energy
2025-12-02T00:00:00.000,Austin,Electrical Permit,2025-150157 EP,4705 WESTSLOPE CIR,I would like to install a 19 kW solar system with 2 Tesla inverters grid-tie only no battery backup using a line side tap
2025-12-02T00:00:00.000,Austin,Building Permit,2025-144719 BP,701 E PARMER LN BLDG 3,MEP modifications within an existing server room.
2025-12-02T00:00:00.000,Austin,Mechanical Permit,2025-124436 MP,401 CONGRESS AVE UNIT 1100,INTERIOR REMODEL OF EXISTING OFFICE SPACE
2025-12-02T00:00:00.000,Austin,Electrical Permit,2025-141699 EP,8113 WILDER RD UNIT 203,ePlan: Residential Expedited Review - SITE PLAN APPROVED: PHASE A - Greystar Plan A581 New 2 story attached unit with 3 bedrooms 2.5 bathrooms and a 2 car garage.
2025-12-02T00:00:00.000,Austin,Mechanical Permit,2025-150058 MP,8113 BOGGY RIDGE DR,Express: Tub to shower conversion in master bath replace hvac system replace electrical service panel
2025-12-02T00:00:00.000,Austin,Plumbing Permit,2025-143724 PP,2524 IONIAN CV,express - changing out faucets in master and changing master tub to a freestanding tub as well. chip and move the plumbing at the master tub
2025-12-02T00:00:00.000,Austin,Plumbing Permit,2025-150981 PP,7517 BOYD HAVEN DR,Installing a new irrigation system
2025-12-02T00:00:00.000,Austin,Plumbing Permit,2025-152313 PP,5507 EXETER DR,Replacement of an existing water heater INSTALL WATER HEATER
2025-12-02T00:00:00.000,Austin,Electrical Permit,2025-151288 EP,504 LONE OAK DR,T pole Ref: 2025-125199-BP
2025-12-02T00:00:00.000,Austin,Electrical Permit,2025-151221 EP,9624 BREEZE HILL DR,Homebuilders loop for New SFR ref 2025-146892 BP. Austin LTD -Bluebonnet
2025-12-02T00:00:00.000,Austin,Electrical Permit,2025-149296 EP,2800 W FRESCO DR,Temporary power loop
2025-12-02T00:00:00.000,Austin,Electrical Permit,2025-150737 EP,12528 BISMARK DR,Adding new dedicated circuit for a GFCI and tankless water heater
2025-12-02T00:00:00.000,Austin,Electrical Permit,2024-087033 EP,2707 WOOLDRIDGE DR,Remodel existing garage into gym. Space to have finishes updated and hvac system installed.
2025-12-02T00:00:00.000,Austin,Mechanical Permit,2024-087033 MP,2707 WOOLDRIDGE DR,Remodel existing garage into gym. Space to have finishes updated and hvac system installed.
2025-12-02T00:00:00.000,Austin,Plumbing Permit,2025-122179 PP,8909 QUICK STREAM DR,Express: I plan on hiring Bats Foundation Repair LLC for foundation repair with 49 steel piers.  Please refer to the attached engineering report I had done by Crosstown Engineering and the work plan with Bats Foundation Repair LLC.
2025-12-02T00:00:00.000,Austin,Electrical Permit,2025-146691 EP,8405 BURRELL DR,Permanent meter rack service only
2025-12-02T00:00:00.000,Austin,Mechanical Permit,2025-114267 MP,2802 BRIDLE PATH,ePlan: Residential Expedited Review - New construction of a 1-Story Single Family Res. [1bed 1bath] with Attached Carport
2025-12-02T00:00:00.000,Austin,Electrical Permit,2025-150953 EP,2202 LONGVIEW ST,Install Level 2 EV Charger
2025-12-02T00:00:00.000,Austin,Electrical Permit,2025-150160 EP,9513 BOATHOUSE DR,Homebuilders loop for New SFR ref 2025-058240 BP. Austin LTD -Bluebonnet
2025-12-02T00:00:00.000,Austin,Building Permit,2025-146985 BP,2503 S 4TH ST,Total Demo of SFR 100 sqft circa 1949
2025-12-02T00:00:00.000,Austin,Electrical Permit,2025-150930 EP,8113 WILDER RD UNIT 101,Homebuilders loop for New SFR ref 2025-141696 BP. Austin Full purpose
2025-12-02T00:00:00.000,Austin,Mechanical Permit,2025-150089 MP,5218 MONARDA MINT DR,Fentress 2982-TR201-L New 2-Story Single Family Residence with (4) bedrooms (2.5) bathrooms Attached Garage Covered Porch Cafe & Loft
2025-12-02T00:00:00.000,Austin,Building Permit,2025-148744 BP,12429 SCOFIELD FARMS DR,We are replacing the shingles and TPO like for like. No structural changes are being made to the building itself.
2025-12-02T00:00:00.000,Austin,Mechanical Permit,2025-113892 MP,401 CONGRESS AVE UNIT 2050,Interior remodel - Spec Suites 2050
2025-12-02T00:00:00.000,Austin,Electrical Permit,2025-151065 EP,4515 ROUNDUP TRL,Upgrading old Federal Pacific panel to a 200A main breaker service
2025-12-02T00:00:00.000,Austin,Electrical Permit,2025-128735 EP,4301 W WILLIAM CANNON DR BLDG H UNIT 110,PROJECT CONSISTS OF INTERIOR TENANT FINISH (RESTAURANT A-2) WITHIN EXISTING BUILDING SHELL SPACE.
2025-12-02T00:00:00.000,Austin,Building Permit,2025-152686 BP,2120 RAVENSCROFT DR,Express: Foundation repair
2025-12-02T00:00:00.000,Austin,Plumbing Permit,2025-147474 PP,12012 RAVENNA CV,Installing a new irrigation system
2025-12-02T00:00:00.000,Austin,Building Permit,2025-151993 BP,4203 PRICKLY PEAR DR,Total demo of SFR 1876 sq ft circa 1966  ***The building shall not be demolished until after the contractor has fulfilled the neighbor notification requirements outlined in Steps 5 & 6 of the Demolition webpage.***
2025-12-02T00:00:00.000,Austin,Building Permit,2025-122179 BP,8909 QUICK STREAM DR,Express: I plan on hiring Bats Foundation Repair LLC for foundation repair with 49 steel piers.  Please refer to the attached engineering report I had done by Crosstown Engineering and the work plan with Bats Foundation Repair LLC.
2025-12-02T00:00:00.000,Austin,Plumbing Permit,2025-151203 PP,7507 BOYD HAVEN DR UNIT A,Installing a new irrigation system
2025-12-02T00:00:00.000,Austin,Building Permit,2025-138644 BP,803 KINNEY AVE,Amnesty CO for non complying sf res circa 1939
2025-12-02T00:00:00.000,Austin,Driveway / Sidewalks,2024-165000 DS,3506 TOM MILLER ST,Construct new driveway approach of 18 FT and sidewalk of 70 LF
2025-12-02T00:00:00.000,Austin,Plumbing Permit,2025-151214 PP,11408 MONET DR,Replacement of an existing water heater Navien 240a2 tankless water heater change out   11408 Monet Drive Austin TX 78726
2025-12-02T00:00:00.000,Austin,Electrical Permit,2025-150696 EP,5009 SUMMERSET TRL,Install 3 GFCI 1 laundry 1 in each bathroom  Replace meter box main panel and subpanel Replace broken light/exhaust combo Replace bedroom fan dimmer with switches
2025-12-02T00:00:00.000,Austin,Plumbing Permit,2025-147502 PP,11905 MURANO DR,Installing a new irrigation system
2025-12-02T00:00:00.000,Austin,Mechanical Permit,2025-140019 MP,5805 HIGHLAND HILLS DR,Replacement of complete existing central heat and air system with or without duct work
2025-12-02T00:00:00.000,Austin,Mechanical Permit,2025-151820 MP,4807 SUMMERSET TRL,Replacement of complete existing central heat and air system with or without duct work Jim Hoadley - replacing like for like 3T Duel Fuel system
2025-12-02T00:00:00.000,Austin,Plumbing Permit,2025-130866 PP,1011 W 5TH ST UNIT 140,Change of Use from Retail Store (Mercantile) to Pilates Studio (Personal Improvement Services). Tenant improvement for a new 2376 s.f pilates studio within an existing building space to include all electrical plumbing and mechanical modifications interior partitions and equipment. No exterior site or structural work.
2025-12-02T00:00:00.000,Austin,Mechanical Permit,2025-104956 MP,9312 KNOLL CREST LOOP,Express - Fire damage repair. Please reference AFD report/architectural sheets/ engineering sheets/ pictures of affected areas that detail the repair. MEP requested for repairs.
2025-12-02T00:00:00.000,Austin,Electrical Permit,2025-150688 EP,9404 OXBOW STRAP DR,temporary tpole for new construction for Wildhorse
2025-12-02T00:00:00.000,Austin,Electrical Permit,2025-150934 EP,8113 WILDER RD UNIT 103,Homebuilders loop for New SFR ref 2025-141697 BP. Austin Full purpose
2025-12-02T00:00:00.000,Austin,Plumbing Permit,2024-106231 PP,8507 WALHILL CV,Expedited Review - New construction of an 2-Story Single-Family Res. [5bed 4bath] with attached Garage.
2025-12-02T00:00:00.000,Austin,Electrical Permit,2025-002568 EP,6404 WILBUR DR,New Inground Pool and Spa
2025-12-02T00:00:00.000,Austin,Building Permit,2025-149396 BP,5505 W PARMER LN,Adding 45 New Dual Chargers and Associated Electrical Gear to an Existing Parking Garage Restriping of Existing ADA EV Parking Rails -Garage 2  2025 086818 000 DA - Concurrent Reviews
2025-12-02T00:00:00.000,Austin,Electrical Permit,2025-150800 EP,7328 LOMBARD LN,Install energy storage system on an existing single family residence. BlueBonnet
2025-12-02T00:00:00.000,Austin,Building Permit,2025-149311 BP,5501 W PARMER LN BLDG G-1,Adding 30 New Dual Chargers and Associated Electrical Gear to an Existing Parking Garage Restriping of Existing ADA EV Parking Rails -Garage 1
2025-12-02T00:00:00.000,Austin,Electrical Permit,2025-150772 EP,6300 E US 290 HWY SVRD WB,LOCATION 4) Remove & discard existing channel letters.  Install new set of internally illuminated LED channel letters on raceway to read ¿extended STAY AMERICA select suites¿ on front elevation = 4 x 14.73 = 58.92 SF.
2025-12-02T00:00:00.000,Austin,Electrical Permit,2025-151791 EP,2206 BLUE MEADOW DR,Construction of a new 67619 SF two story elementary school (Building A)
2025-12-02T00:00:00.000,Austin,Electrical Permit,2025-142258 EP,9219 OLD MANOR RD UNIT 100,New Construction of a Small Spec Suite in ETJ
2025-12-02T00:00:00.000,Austin,Electrical Permit,2025-141698 EP,8113 WILDER RD UNIT 201,ePlan: Residential Expedited Review - SITE PLAN APPROVED: PHASE A - Greystar Plan A581 New 2 story attached unit with 3 bedrooms 2.5 bathrooms and a 2 car garage.
2025-12-02T00:00:00.000,Austin,Building Permit,2025-132789 BP,1700 INVERNESS BLVD,New 1-story detached garage with mini split (MP) and electric (EP)
2025-12-02T00:00:00.000,Austin,Plumbing Permit,2025-137548 PP,3112 PRADO ST,Capoff for water and wastewater  for Total demo of SFR 1028 SF circa 1960
2025-12-02T00:00:00.000,Austin,Mechanical Permit,2025-150115 MP,7403 EASTCREST DR,Replacement of complete existing central heat and air system with or without duct work LLOYD JOLLY
2025-12-02T00:00:00.000,Austin,Building Permit,2025-152675 BP,8920 STAMBOURNE ST,Express: Foundation repair
2025-12-02T00:00:00.000,Austin,Plumbing Permit,2025-139374 PP,5700 TRAILRIDGE DR,55 tunnel below the foundation to replace entire drain system. 2 access holes - front right
2025-12-02T00:00:00.000,Austin,Electrical Permit,2025-150736 EP,13304 KINCANE DR,Temporary tpole for new construction for Stoney Chase
2025-12-02T00:00:00.000,Austin,Plumbing Permit,2025-151331 PP,2503 S 4TH ST,Cap off Water & Wastewater
2025-12-02T00:00:00.000,Austin,Mechanical Permit,2025-151582 MP,3920 MYRICK DR,Replacement of complete existing central heat and air system with or without duct work Garage attic.
2025-12-02T00:00:00.000,Austin,Plumbing Permit,2025-151470 PP,205 SHANT ST,Replacement of an existing water heater BRIDGET OLIVARES
2025-12-02T00:00:00.000,Austin,Plumbing Permit,2025-135865 PP,4516 SETON CENTER PKWY UNIT 350,Interior alteration of an existing office space. Suite 350.
2025-12-02T00:00:00.000,Austin,Plumbing Permit,2025-152609 PP,5406 MOUNTAIN CEDAR CV,Gas Test after leak repairs to reinstate service.
2025-12-02T00:00:00.000,Austin,Electrical Permit,2025-150972 EP,9216 CALVERT WAY,Homebuilders loop for New SFR ref 2025-144123 BP. Austin LTD -Bluebonnet
2025-12-02T00:00:00.000,Austin,Building Permit,2025-152920 BP,1221 E 6TH ST,2025 Inn Cahoots Tent  This BP is for a special Event but cannot be finalized due to and SSI issue. The BP for this tent has passed final inspection and should be in final status.
2025-12-02T00:00:00.000,Austin,Plumbing Permit,2025-151070 PP,9101 THE RAVINE WAY,Installing a new irrigation system
2025-12-02T00:00:00.000,Austin,Plumbing Permit,2025-146115 PP,3801 N CAPITAL OF TEXAS HWY NB BLDG I UNIT 100,Interior Build-out of an Existing Gym for Suite I-100
2025-12-02T00:00:00.000,Austin,Plumbing Permit,2025-146085 PP,2629 W 49TH ST,install a full lawn sprinkler system
2025-12-02T00:00:00.000,Austin,Mechanical Permit,2025-149884 MP,9120 BURNET RD UNIT 130,ePlan: Commercial Expedited Review - Interior Remodel to Existing Office/Warehouse. Work to include subdividing Existing Interior into Multiple Suites and New Overhead Doors at Warehouse (29365 SF)
2025-12-02T00:00:00.000,Austin,Building Permit,2025-136138 BP,325 W 6TH ST,THE GENERAL SCOPE OF THE PROJECT INCLUDES A ~17500 SF FIRST GENERATION BUILDOUT OF THE 20230 SF 12TH AND 14TH FLOOR SPACE OF AN EXISTING 57 FLOOR BUILDING. THIS INCLUDES BUT IS NOT LIMITED TO NEW WALLS DOOR CEILINGS CASEWORK LIGHTING AND MEP SYSTEMS.
2025-12-02T00:00:00.000,Austin,Plumbing Permit,2025-152300 PP,5200 CLOUDCROFT DR,Replacement of an existing water heater INSTALL OF 40 GAL WATER HEATER
2025-12-02T00:00:00.000,Austin,Electrical Permit,2025-151819 EP,111-1/2 MILDRED STREET,T Pole Ref: 2025-133764-BP
2025-12-02T00:00:00.000,Austin,Mechanical Permit,2025-152278 MP,2005 POMPTON DR,interior remodel and carport enclosure - adding 2 bedrooms and a bathroom new finishes. all changes happening within existing footprint. carport enclosure
2025-12-02T00:00:00.000,Austin,Mechanical Permit,2024-087028 MP,2707 WOOLDRIDGE DR,Remodel scope of work to include refinishing interiors interior remodel with relocation of some interior walls sitting area adjacent to the living room to be lowered to match the same floor level.
2025-12-02T00:00:00.000,Austin,Building Permit,2025-150202 BP,1100 W PARMER LN,Install a new 15 year 40 mil PVC Duro-Last single ply roof system over the existing modified.
2025-12-02T00:00:00.000,Austin,Mechanical Permit,2025-146633 MP,901 S MOPAC EXPY SVRD NB BLDG 5 UNIT 300,Interior non structural remodel f existing office space B;DG 5 STE 300
2025-12-02T00:00:00.000,Austin,Electrical Permit,2025-101048 EP,7 PASCAL LN,New construction in-ground pool and spa.
2025-12-02T00:00:00.000,Austin,Electrical Permit,2025-150161 EP,9208 THE RAVINE WAY,Homebuilders loop for New SFR ref 2025-066760 BP. Austin LTD -Bluebonnet
2025-12-02T00:00:00.000,Austin,Mechanical Permit,2025-114266 MP,1700 MEADOWBROOK DR,ePlan: Residential Expedited Review - New construction of a 2-Story Single Family Res. [5bed 6bath] with Attached Garage and Carport
2025-12-02T00:00:00.000,Austin,Plumbing Permit,2025-153129 PP,8519 CAHILL DR UNIT 13,Gas leak Repair: we need to stub up a new riser so they¿re able to tie in new meter. Will dig with excavator to be able to catch the bottom part of the pipe and come up with a new riser.
2025-12-02T00:00:00.000,Austin,Electrical Permit,2025-146687 EP,10901 N LAMAR BLVD BLDG C UNIT 309,CHANGE OF USE from Office to Indoor Sports & Recreation Use and Tenant Finish Out  2025 077826 DA -Approved
2025-12-02T00:00:00.000,Austin,Mechanical Permit,2025-063004 MP,5107 WOODGREEN CV,Retroactive: A portion of the current balcony was converted to a storage closet. Kitchen remodel: remove 2 walls of garage to enlarge kitchen furr-down in living room removed 2nd story bathroom remodeled and paralleled attic space converted into walk in closet. Convert attic and closet space into a new balcony.
2025-12-02T00:00:00.000,Austin,Plumbing Permit,2019-212964 PP,1300 MC KIE DR BLDG 5,Building 5 Unit 52 and Unit 51.  New condominium residential duplex 2 stories 5 bedroom 5 bathroom attached 2 car garages covered porch and patio.
2025-12-02T00:00:00.000,Austin,Mechanical Permit,2025-151438 MP,5906 RAIN CREEK PKWY,Replacement of complete existing central heat and air system with or without duct work
2025-12-02T00:00:00.000,Austin,Electrical Permit,2025-123038 EP,1312 BRUTON SPRINGS RD,Addition - A new 1996 sf addition to an existing 2180 sf home. Project will include a 660sf covered terrace and a hot tub spa.
2025-12-02T00:00:00.000,Austin,Building Permit,2025-140610 BP,3500 E PARMER LN UNIT 3120,First time tenant finishout to create sweet shop.
2025-12-02T00:00:00.000,Austin,Electrical Permit,2025-150938 EP,8113 WILDER RD UNIT 202,Homebuilders loop for New SFR ref 2025-134375 BP. Austin Full purpose
2025-12-02T00:00:00.000,Austin,Plumbing Permit,2025-151978 PP,8815 SCOTSMAN DR,Replacement of an existing water heater REPLACMENT OF 2 WATER HEATERS
2025-12-02T00:00:00.000,Austin,Electrical Permit,2025-144865 EP,1705 KIT CIR,New Single Family Residence
2025-12-02T00:00:00.000,Austin,Plumbing Permit,2025-147800 PP,3203 CLAWSON RD,Addition attached to existing home consisting of 2 beds 1 baths demo existing detached garage demo of existing patio
2025-12-02T00:00:00.000,Austin,Electrical Permit,2025-134029 EP,707 W CRESTLAND DR,interior remodel - the exterior siding insulation and interior sheetrock will be renewed/replace. The affected area is limited to one side of the house (the North side) Two new transom windows will be installed to this side. New cabinetry will be installed in the kitchen. No changes will be made to the tile flooring and no plumbing changes. A licensed electrician will rewire the entire house and install a new service panel.
