date,city,permit_type,permit_number,address,description
2025-12-09T00:00:00.000,Austin,Plumbing Permit,2025-137655 PP,4007 EDGEROCK DR,Cap off water/waste water lines
2025-12-09T00:00:00.000,Austin,Plumbing Permit,2025-149776 PP,4007 EDGEROCK DR,ePlan: Residential Expedited Review -  New construction of a 2-Story Single Family Res. [4 bed 4bath]  Attached Carport.
2025-12-09T00:00:00.000,Austin,Plumbing Permit,2025-149777 PP,4007 EDGEROCK DR,Autofill/Heated pool/spa.
2025-12-08T00:00:00.000,Austin,Plumbing Permit,2025-152515 PP,5106 CLOVERDALE LN,Replacement of an existing water heater Replace 40-gallon gas water heater in garage
2025-12-08T00:00:00.000,Austin,Mechanical Permit,2025-151054 MP,8700 BRODIE LN BLDG 5 UNIT 527,Replacement of complete existing central heat and air system with or without duct work
2025-12-08T00:00:00.000,Austin,Electrical Permit,2025-153409 EP,1501 HARDOUIN AVE,Whole home generator installation.
2025-12-08T00:00:00.000,Austin,Plumbing Permit,2025-152322 PP,11500 SATCHEL DR,Replacement of an existing water heater Standard 40 Gal Natural Gas water heater change out   11500 Satchel Drive Austin TX 78754
2025-12-08T00:00:00.000,Austin,Building Permit,2025-153294 BP,3813 WADFORD ST,AT&T proposes to - Tower SOW: Remove (3) RRu Radios (3) Diplexers & (10) 50A Coax. Decommission (3) RRUs B2 / B66 Radios (in place) Relocated (3) Air Antennas Install mount modification per mount analysis Install (3) Air Antennas Install (3) B25 / B66 Radios Ground SOW: Install (6) 50A DC Breakers in existing DC Power Plant
2025-12-08T00:00:00.000,Austin,Plumbing Permit,2025-153136 PP,8009 RUNNING WATER DR,Excavate 10 tunnel to repair drain line under house
2025-12-08T00:00:00.000,Austin,Plumbing Permit,2025-085210 PP,3711 BRIDLE PATH UNIT 2,Retro Active permit of accessory dwelling unit and attached carport
2025-12-08T00:00:00.000,Austin,Building Permit,2025-155039 BP,13229 KINCANE DR,2245CL NEW 2 STORY 4 BEDROOM 3 BATH SINGLE FAMILY RESIDENTIAL HOME WITH ATTACHED GARAGE COVERED FRONT PORCH AND REAR PATIO
2025-12-08T00:00:00.000,Austin,Plumbing Permit,2025-151595 PP,5406 BULL RUN CIR,Per PC agent: Tunneling 70 sewer replacement with 4 access holes & Trenching 100 sewer replacement in yard 12/5/2025  Tunneling under home to replace entire sewer system with 3-4 access holes Total of 70 sewer replacement
2025-12-08T00:00:00.000,Austin,Plumbing Permit,2025-153736 PP,14017 AXEL JOHANSON DR,New Construction of SFR in ETJ
2025-12-08T00:00:00.000,Austin,Mechanical Permit,2025-151791 MP,2206 BLUE MEADOW DR,Construction of a new 67619 SF two story elementary school (Building A)
2025-12-08T00:00:00.000,Austin,Electrical Permit,2025-144518 EP,502 BRUSHY ST,28321 Brushy Street Commons Exterior Signs EAST Elevation
2025-12-08T00:00:00.000,Austin,Mechanical Permit,2025-154529 MP,7000 CONVICT HILL RD UNIT 6212,Replacement of complete existing central heat and air system with or without duct work
2025-12-08T00:00:00.000,Austin,Mechanical Permit,2025-149863 MP,5222 ROGERS LN,Replacement of complete existing central heat and air system with or without duct work replaced central HVAC system with ductwork
2025-12-08T00:00:00.000,Austin,Plumbing Permit,2025-155288 PP,1106 W DITTMAR RD,ePlan: Expedited Review - Addition and Interior Remodel to an existing Hospital to include installation of new electrical panels (14700 SF).
2025-12-08T00:00:00.000,Austin,Mechanical Permit,2025-150288 MP,3232 E CESAR CHAVEZ ST UNIT 2300,ePlan Review:  Tenant Finish out to create office (7 applications-unit 2220 224022602300234023602380)
2025-12-08T00:00:00.000,Austin,Building Permit,2025-154828 BP,1830 SIMOND AVE,Change the Accessory Use in Rooms 226-229 from Day Care Services back to the previous flexible assembly space. No work proposed
2025-12-08T00:00:00.000,Austin,Electrical Permit,2025-148097 EP,1323 S CONGRESS AVE,ARIAT w/logo illuminated face-lit Channel letters for storefront
2025-12-08T00:00:00.000,Austin,Electrical Permit,2025-134561 EP,9205 THE RAVINE WAY,New inground swimming pool and concrete decking w/ reqd enclosure device for existing 2-story single family residence.
2025-12-08T00:00:00.000,Austin,Electrical Permit,2025-150748 EP,5414 ROGERS LN BLDG B,Overhead service riser damaged by moving truck. We are to replace damaged components without altering the service amperages or set up in any manner.
2025-12-08T00:00:00.000,Austin,Electrical Permit,2025-153345 EP,12110 CANTABRIA RD,homebuilder loop refer to 2025 - 151529 BP
2025-12-08T00:00:00.000,Austin,Electrical Permit,2025-149245 EP,3309 KAY ST,interior remodel/garage conversion - enclosing the back porch area and adding the space to the existing laundry room. Dining room back door will be relocated from the south to the west side of the house
2025-12-08T00:00:00.000,Austin,Building Permit,2025-150927 BP,11125 AVERING LN,Express- Replace 2 tub to shower 1 piece prefabricated acrylic no electrical work needed replace valve with new shower valve only working in wet space.
2025-12-08T00:00:00.000,Austin,Mechanical Permit,2025-151056 MP,701 W LONGSPUR BLVD UNIT 2081,Replacement of complete existing central heat and air system with or without duct work
2025-12-08T00:00:00.000,Austin,Electrical Permit,2025-139203 EP,9601 STREAMSIDE DR,Rooftop solar upgrade to existing residence. Existing system removed.
2025-12-08T00:00:00.000,Austin,Electrical Permit,2025-154273 EP,3011 FONTANA DR UNIT A,Reference: 2025-115675EP & 2025-115676 Temp. Overhead meter loop for construction will be building New Duplex.
2025-12-08T00:00:00.000,Austin,Electrical Permit,2025-145160 EP,11101 BENDING BOUGH TRL,Meter base replacement
2025-12-08T00:00:00.000,Austin,Building Permit,2025-154976 BP,8009 CORRIGAN PASS,New construction in-ground pool w/ concrete deck.
2025-12-08T00:00:00.000,Austin,Driveway / Sidewalks,2025-143379 DS,3019 GARWOOD ST,Construct new driveway approach of 16 FT and sidewalk of 44 FT.
2025-12-08T00:00:00.000,Austin,Electrical Permit,2025-131767 EP,2903 OAKHURST AVE,Add New roof dormer interior remodel
2025-12-08T00:00:00.000,Austin,Plumbing Permit,2023-156536 PP,8701 DECKER LAKE RD,Install water and waste water and fire line
2025-12-08T00:00:00.000,Austin,Building Permit,2025-146898 BP,1206 E 52ND ST BLDG B UNIT 201,Interior renovation of five units in a multi-family buildings. Construct fire rated partitions between units. Convert existing tubs to showers replace all existing counter tops cabinets and fixtures and equipment with new.    [7 Day Review - Multi-Apps. (5)]
2025-12-08T00:00:00.000,Austin,Electrical Permit,2025-117332 EP,4605 LAVA ISLAND DR,Abilene S402 A Right New - 1 Story SFR w/ 3 bedrooms 2 bathrooms attached 2 car garage covered entry porch and patio required parking: 2.
2025-12-08T00:00:00.000,Austin,Plumbing Permit,2025-153732 PP,14120 MATTEROD DR,New Construction of SFR in ETJ
2025-12-08T00:00:00.000,Austin,Mechanical Permit,2025-147916 MP,12340 ALAMEDA TRACE CIR UNIT 2104,Replacement of complete existing central heat and air system with or without duct work
2025-12-08T00:00:00.000,Austin,Building Permit,2025-150564 BP,3210 KRAMER LN,Installation of EV Charging Stations
2025-12-08T00:00:00.000,Austin,Plumbing Permit,2025-152105 PP,10116 ALY MAY DR,Replacement of an existing water heater Replace 40-gallon gas water heater inside garage.
2025-12-08T00:00:00.000,Austin,Mechanical Permit,2025-138476 MP,7013 WOODFORD WAY,New construction single-family residential 2-story 4 bedroom 3.5 bath with attached 2-car garage covered front porch and covered rear patio.
2025-12-08T00:00:00.000,Austin,Mechanical Permit,2023-076844 MP,1309 CHICON ST,5-story 53-unit mixed-use affordable housing project (separate permit) with retail shell space (THIS PERMIT) on the first floor. Units 101 - 103  This project is part of the Affordability Unlocked program and will also be a SMART housing project.
2025-12-08T00:00:00.000,Austin,Plumbing Permit,2025-146001 PP,5001 WESTVIEW DR,Cap off water/waste water
2025-12-08T00:00:00.000,Austin,Mechanical Permit,2025-087156 MP,112 WILL DAVIS DR UNIT 110,Finish out to create Spec office. (Unit 110 and Unit 115)
2025-12-08T00:00:00.000,Austin,Mechanical Permit,2025-087157 MP,112 WILL DAVIS DR UNIT 115,Finish out to create Spec office. (Unit 110 and Unit 115)
2025-12-08T00:00:00.000,Austin,Mechanical Permit,2025-075790 MP,3101 1/2 NEAL ST,ePlan: Residential Expedited Review - New construction of a 3-Story Single Family Res. [4bed 3bath] with Attached Carport. 3101 1/2 Neal St
2025-12-08T00:00:00.000,Austin,Electrical Permit,2025-019484 EP,2409 LA CASA DR BLDG 1,BLDG 1: New 3 story SFR construction with 2 bedrooms 3.5 bath and attached carport.
2025-12-08T00:00:00.000,Austin,Electrical Permit,2025-150089 EP,5218 MONARDA MINT DR,Fentress 2982-TR201-L New 2-Story Single Family Residence with (4) bedrooms (2.5) bathrooms Attached Garage Covered Porch Cafe & Loft
2025-12-08T00:00:00.000,Austin,Mechanical Permit,2024-073858 MP,5012 E 7TH ST,CHANGE OF USE from Restaurant/Gymnasium to Personal Use and New Single Story 640 Square Feet Shipping Structure to be used as a Hair Salon   Extended 12/4/24 rb
2025-12-08T00:00:00.000,Austin,Building Permit,2025-153303 BP,11107 GRAPEVINE LN,addition and remodel - punch through crawl space to build out new basement space adding exterior covered decking and pool
2025-12-08T00:00:00.000,Austin,Building Permit,2025-146899 BP,1206 E 52ND ST BLDG B UNIT 202,Interior renovation of five units in a multi-family buildings. Construct fire rated partitions between units. Convert existing tubs to showers replace all existing counter tops cabinets and fixtures and equipment with new.    [7 Day Review - Multi-Apps. (5)]
2025-12-08T00:00:00.000,Austin,Building Permit,2025-149972 BP,8309 SILHOUETTE ST,ePlan: Residential Expedited Review:  Garage conversion.  1 parking space in existing 3-car garage is to be converted to a bedroom/playroom.
2025-12-08T00:00:00.000,Austin,Plumbing Permit,2025-153993 PP,2601 TOWY RD,Install Irrigation system
2025-12-08T00:00:00.000,Austin,Mechanical Permit,2025-057033 MP,1302 MORGAN LN BLDG 2,ePlan: Residential Expedited Review - New construction of a 2-Story Single Family Res. [2bed 2.5bath]. Bldg 2
2025-12-08T00:00:00.000,Austin,Mechanical Permit,2025-147900 MP,9500 DESSAU RD UNIT 1024,Replacement of complete existing central heat and air system with or without duct work
2025-12-08T00:00:00.000,Austin,Electrical Permit,2025-150913 EP,9513 ARGYLE DR,new 60 amp 240 volt line to power 48 amp tesla wall connector (hardwired) from 200amp service panel.
2025-12-08T00:00:00.000,Austin,Electrical Permit,2023-085434 EP,709 W MILTON ST,Detached 1-story cabana [1bath]
2025-12-08T00:00:00.000,Austin,Plumbing Permit,2015-112471 PP,10804 RUSH RD,Install new irrigation system to res.
2025-12-08T00:00:00.000,Austin,Mechanical Permit,2025-153491 MP,5203 DRY WELLS RD,Replacement of complete existing central heat and air system with or without duct work
2025-12-08T00:00:00.000,Austin,Mechanical Permit,2025-061287 MP,301 WEST AVE UNIT 120,Interior Remodel of Existing Office to include Access Control System for Unit 120
2025-12-08T00:00:00.000,Austin,Mechanical Permit,2025-147902 MP,9500 DESSAU RD UNIT 1322,Replacement of complete existing central heat and air system with or without duct work
2025-12-08T00:00:00.000,Austin,Building Permit,2025-148768 BP,2901 S CAPITAL OF TEXAS HWY NB UNIT E03,Interior Non Structural Demolition
2025-12-08T00:00:00.000,Austin,Driveway / Sidewalks,2025-145171 DS,3411 BRIDLE PATH,Construct new driveway approach of 16 FT and Curb/Gutter of 20 FT.  No sidewalk inspection per plan review.
2025-12-08T00:00:00.000,Austin,Mechanical Permit,2024-164976 MP,4812 CASWELL AVE BLDG A,Scope of work only pertains to Unit A. Adding a new Master bedroom with full bathroom increasing living and adding new office. Reducing driveway sq ft.
2025-12-08T00:00:00.000,Austin,Plumbing Permit,2025-152328 PP,1123 GUNTER ST,Replacement of an existing water heater Navien tankless water heater change out    1123 1/2 Gunter Street Austin TX 78702 USA (937) 654-8647
2025-12-08T00:00:00.000,Austin,Plumbing Permit,2025-154473 PP,2604 DERWENT DR,Plumbing for New Construction of SFR in the ETJ 1551 sq ft   Ref: 2025-151038 W          2025-151731 WW
2025-12-08T00:00:00.000,Austin,Electrical Permit,2025-128604 EP,2503 E 18TH ST,New Autofill Pool with plumbing permit
2025-12-08T00:00:00.000,Austin,Plumbing Permit,2025-145617 PP,2903 HILLVIEW RD,Interior Remodel  addition to existing residence new detached garage with dwelling unit above
2025-12-08T00:00:00.000,Austin,Electrical Permit,2025-153655 EP,4601 LAVA ISLAND DR,temporary tpole for new construction for cascades at oc
2025-12-08T00:00:00.000,Austin,Driveway / Sidewalks,2025-145140 DS,3004 SORIN ST,Construct new driveway approach of 16 FT and sidewalk of 22.6 LF. Driveway approach is from alley.
2025-12-08T00:00:00.000,Austin,Electrical Permit,2025-122981 EP,2000 RIVERSIDE FARMS RD BLDG MC1,MC1 7 UNITS 2022-087556EP     2022-082165EP 2022-111379EP      2022-111382EP UNIT #- 4101 3101 2101 2102 1101 1102 HP1
2025-12-08T00:00:00.000,Austin,Building Permit,2025-154959 BP,8909 PEDAL BOAT DR,New 1-story single family residence 3 bed/2.5 bath attached garage covered porch and patio Green building
2025-12-08T00:00:00.000,Austin,Mechanical Permit,2025-151066 MP,4411 SPICEWOOD SPRINGS RD UNIT 109,Replacement of complete existing central heat and air system with or without duct work
2025-12-08T00:00:00.000,Austin,Plumbing Permit,2025-100797 PP,4509 LAVA ISLAND DR,Abilene S402 B Right New - 1 Story SFR w/ 3 bedrooms 2 bathrooms attached 2 car garage covered entry porch and patio required parking: 2.
2025-12-08T00:00:00.000,Austin,Driveway / Sidewalks,2025-091170 DS,4101 MENCHACA RD,Construct new driveway approach of 24 FT and sidewalk of 70 LF and curb & gutter of 25 FT.    Inspection paid through 2024 087982 000 00 SSI
2025-12-08T00:00:00.000,Austin,Building Permit,2025-150926 BP,8317 CROSS PARK DR,Upgrade AT&T equipment on an existing colocation rooftop
2025-12-08T00:00:00.000,Austin,Plumbing Permit,2025-145794 PP,6601 MITRA DR,Replacement of an existing water heater 40-gal GAS Water heater changeout like for like
2025-12-08T00:00:00.000,Austin,Electrical Permit,2025-154851 EP,5900 MOUNTAINCLIMB DR BLDG B,plug for water heater
2025-12-08T00:00:00.000,Austin,Mechanical Permit,2024-084947 MP,2405 RIDGEVIEW ST,Preserve and renovate existing house and add connected addition.  Run existing elect service underground Redo driveway front steps and beck deck.  Preserve and renovate existing house and add connected addition redo driveway front entry steps and back deck pay fee instead of sidewalk installation
2025-12-08T00:00:00.000,Austin,Mechanical Permit,2025-153488 MP,12325 LOS INDIOS TRL UNIT 15,Replacement of complete existing central heat and air system with or without duct work
2025-12-08T00:00:00.000,Austin,Mechanical Permit,2024-003456 MP,7051 MEADOW LAKE BLVD BLDG 15,New Construction of Multi-Family Bldg. #15
2025-12-08T00:00:00.000,Austin,Plumbing Permit,2025-154479 PP,4201 TURKEY CREEK DR,Replacement of an existing water heater Gallon Water Heater Install in Attic.
2025-12-08T00:00:00.000,Austin,Mechanical Permit,2025-153970 MP,10502 SCHOOL HOUSE LN,Replacement of complete existing central heat and air system with or without duct work
2025-12-08T00:00:00.000,Austin,Driveway / Sidewalks,2025-142350 DS,1409 CEDAR AVE,Demo sidewalk and construct new sidewalk of 17 LF sidewalk.
2025-12-08T00:00:00.000,Austin,Mechanical Permit,2025-151057 MP,2011 E 6TH ST BLDG 4 UNIT 4201,Replacement of complete existing central heat and air system with or without duct work
2025-12-08T00:00:00.000,Austin,Plumbing Permit,2025-117331 PP,4601 LAVA ISLAND DR,Falcon S404 C Left New - 2 Story SFR w/ 4 bedrooms 2.5 bathrooms attached 2 car garage covered entry porch and patio required parking: 2.
2025-12-08T00:00:00.000,Austin,Mechanical Permit,2025-152976 MP,3921 LEAFIELD DR,Interior remodel reconfiguring master bathroom adding kitchen island adding outdoor patio and pergola.
2025-12-08T00:00:00.000,Austin,Plumbing Permit,2025-143630 PP,4304 SMALL DR,Replacement of an existing water heater 40-gal GAS water heater changeout like for like
2025-12-08T00:00:00.000,Austin,Electrical Permit,2025-148654 EP,8101 ASMARA DR,Replace existing 200A panel with new 200A.  Update grounding and bonding.  Install surge protection.  Replace meter base with 200A AE approved base.
2025-12-08T00:00:00.000,Austin,Plumbing Permit,2025-153942 PP,206 E 34TH ST,SEWER YARD LINE REPLACEMENT
2025-12-08T00:00:00.000,Austin,Plumbing Permit,2025-154075 PP,1207 KINNEY AVE,Replacement of an existing water heater new rheem 50 gallon natural gas tank power vent water heater. change out   1207 Kinney Avenue #B Austin TX 78704
2025-12-08T00:00:00.000,Austin,Electrical Permit,2025-152100 EP,13820 CEYLON TEA CIR,Requesting this permit to perform a meter can upgrade
2025-12-08T00:00:00.000,Austin,Mechanical Permit,2025-154533 MP,6307 BLUFF SPRINGS RD UNIT 2111,Replacement of complete existing central heat and air system with or without duct work
2025-12-08T00:00:00.000,Austin,Building Permit,2025-154858 BP,11001 LAKELINE BLVD BLDG 1 UNIT 300,Interior non structural demolition
2025-12-08T00:00:00.000,Austin,Electrical Permit,2025-138708 EP,13001 HARRIS RIDGE BLVD BLDG PUMP,Install new 200 amp 3 phase service for retention pond.
2025-12-08T00:00:00.000,Austin,Plumbing Permit,2025-154773 PP,6400 STOCKMAN DR BLDG 3,irrigation install
2025-12-08T00:00:00.000,Austin,Mechanical Permit,2025-151062 MP,8700 BRODIE LN BLDG 2 UNIT 232,Replacement of complete existing central heat and air system with or without duct work
2025-12-08T00:00:00.000,Austin,Plumbing Permit,2025-151796 PP,8308 BRIARWOOD LN,Replacement of an existing water heater REPLACE 40-GAL GAS WATER HEATER with INSIDE INTERIOR CLOSET.
2025-12-08T00:00:00.000,Austin,Mechanical Permit,2025-152970 MP,2324 S LAMAR BLVD UNIT 110,Interior Remodel (Mechanical Scope Only) to an Existing Retail Space - Suite 110
2025-12-08T00:00:00.000,Austin,Plumbing Permit,2025-152857 PP,1614 STRICKLAND DR,Replacement of an existing water heater Standard 50 Gal Electric Water Heater change out   1614 Strickland Drive Austin TX 78748
2025-12-08T00:00:00.000,Austin,Building Permit,2025-145580 BP,1429 BERKSHIRE DR,Express: Replace 8 windows (like for like)
2025-12-08T00:00:00.000,Austin,Plumbing Permit,2025-154776 PP,6400 STOCKMAN DR BLDG 2,irrigation install
2025-12-08T00:00:00.000,Austin,Plumbing Permit,2025-152094 PP,4503 PLACID PL,Replacement of an existing water heater Replace 29gal gas water heater Tall in Garage Closet
2025-12-08T00:00:00.000,Austin,Plumbing Permit,2025-151949 PP,12430 ZELLER LN,Replacement of an existing water heater REPLACE 50-GAL GAS WATER HEATER IN GARAGE
2025-12-08T00:00:00.000,Austin,Mechanical Permit,2025-151117 MP,3906 LAGUNA VISTA CV,Replacement of complete existing central heat and air system with or without duct work Also includes supply and return air plenums.
2025-12-08T00:00:00.000,Austin,Building Permit,2025-155037 BP,9305 SPRING HOLLOW DR,New pool concrete decking removal of wood deck  336 sf  pool
2025-12-08T00:00:00.000,Austin,Building Permit,2025-155514 BP,4804 PALISADE DR,Express- Replacing 12 windows and 2 sliding doors like for like
2025-12-08T00:00:00.000,Austin,Electrical Permit,2025-153740 EP,11919 LA BARZOLA BND,Request to Disconnect Install a meter collar on an AE meter base behind the AE meter as part of an ESS I will be installing.  Installation involves reconfiguring existing solar BOS components so I will need access to the PV meter as well.
2025-12-08T00:00:00.000,Austin,Building Permit,2025-154503 BP,2657 WINDING BROOK DR,Express- Existing foundation repair as per scope of work attached
2025-12-08T00:00:00.000,Austin,Mechanical Permit,2025-153448 MP,7522 MEADOWVIEW LN,Replacement of complete existing central heat and air system with or without duct work
2025-12-08T00:00:00.000,Austin,Plumbing Permit,2025-154408 PP,1310 LBJ WAY UNIT FW1,REF 2024-084740 BP roughly 10 ft water on the domestic  rougly 16 LF sanitary sewer
2025-12-08T00:00:00.000,Austin,Plumbing Permit,2025-154612 PP,7814 ELLA LEE LN,Installing a new irrigation system
2025-12-08T00:00:00.000,Austin,Electrical Permit,2025-019486 EP,2409 LA CASA DR BLDG 3,BLDG 3: New 3 story SFR construction with 2 bedrooms 3.5 bath and attached carport.
2025-12-08T00:00:00.000,Austin,Mechanical Permit,2025-153481 MP,2302 RUNDELL PL,Replacement of complete existing central heat and air system with or without duct work
2025-12-08T00:00:00.000,Austin,Mechanical Permit,2025-145061 MP,2011 E 6TH ST BLDG 7 UNIT 7110,Replacement of complete existing central heat and air system with or without duct work
2025-12-08T00:00:00.000,Austin,Plumbing Permit,2025-151160 PP,2514 WOOLDRIDGE DR,Total demo of SFR 6083 sq ft circa 1938  ***The building shall not be demolished until after the contractor has fulfilled the neighbor notification requirements outlined in Steps 5 & 6 of the Demolition webpage.***
2025-12-08T00:00:00.000,Austin,Plumbing Permit,2025-154484 PP,13402 UNDERBANK RD,Plumbing for New Construction of SFR in the ETJ 1950 sq ft   Ref:  2025-151245 W           2025-151741 WW
2025-12-08T00:00:00.000,Austin,Mechanical Permit,2025-057034 MP,1302 MORGAN LN BLDG 3,ePlan: Residential Expedited Review - New construction of a 2-Story Single Family Res. [3bed 3bath] with attached Garage/Carport. Bldg 3
2025-12-08T00:00:00.000,Austin,Plumbing Permit,2025-146740 PP,10712 DESERT WILLOW LOOP,Replacement of an existing water heater 50-gal GAS water heater changeout like for like
2025-12-08T00:00:00.000,Austin,Building Permit,2025-146902 BP,1206 E 52ND ST BLDG B UNIT 205,Interior renovation of five units in a multi-family buildings. Construct fire rated partitions between units. Convert existing tubs to showers replace all existing counter tops cabinets and fixtures and equipment with new.    [7 Day Review - Multi-Apps. (5)]
2025-12-08T00:00:00.000,Austin,Electrical Permit,2025-148618 EP,8300 SUMMER PLACE DR,*Partial Demo* Interior remodel
2025-12-08T00:00:00.000,Austin,Mechanical Permit,2025-085829 MP,1012 BRICKELL LOOP UNIT B,*Green Building* (Unit B/14) New construction of attached condo (duplex) with 3 beds 2.5 baths and attached 2 car garage each  PUD
2025-12-08T00:00:00.000,Austin,Plumbing Permit,2025-081539 PP,1910 ALEGRIA RD,Cap off of Water & Wastewater for a Total Demo of SFR 1884 sqft circa 1948
2025-12-08T00:00:00.000,Austin,Plumbing Permit,2025-153625 PP,12124 CANTABRIA RD,Installing a new irrigation system
2025-12-08T00:00:00.000,Austin,Plumbing Permit,2024-164051 PP,200 W SLAUGHTER LN UNIT 130,Tenant Finish Out for Dental Office for Suite 103
2025-12-08T00:00:00.000,Austin,Plumbing Permit,2025-096106 PP,2308 HOLLY ST,Interior Remodel (full scope on app)
2025-12-08T00:00:00.000,Austin,Mechanical Permit,2024-003457 MP,7051 MEADOW LAKE BLVD BLDG 16,New Construction of Multi-Family Bldg. #16
2025-12-08T00:00:00.000,Austin,Mechanical Permit,2025-133933 MP,2811 E 5TH ST UNIT B,Change of use from warehouse to artist workshop and tenant finish out
2025-12-08T00:00:00.000,Austin,Plumbing Permit,2025-144123 PP,9216 CALVERT WAY,*Green Building* New 2-story 4 bedroom 4.5 bathroom single family residence with attached garage covered front porch and rear covered patio.
2025-12-08T00:00:00.000,Austin,Electrical Permit,2025-152657 EP,408 CLOVER CT,we are requesting our temporary t pole or temporary power to continue with our 3 house project on this property@ 408 Clover Court Ref 2025-110307 BP
2025-12-08T00:00:00.000,Austin,Electrical Permit,2025-153744 EP,2406 EUCLID AVE BLDG MC1,install service for new construction houses that AE is requiring the service to be permitted seperately. Ref: 2024-073287-BP
2025-12-08T00:00:00.000,Austin,Building Permit,2025-153147 BP,12342 HUNTERS CHASE DR BLDG 8,Hunters Chase Apartments - Building 8 - Foundation Repair - Installing 27 Exterior Pillings
2025-12-08T00:00:00.000,Austin,Electrical Permit,2025-105803 EP,2003 GREENWOOD AVE BLDG 3,ePlan: Residential Expedited Review - New THREE UNIT RES. New construction of MODULAR a 1-Story Single Family Res. [2bed 2bath]
2025-12-08T00:00:00.000,Austin,Plumbing Permit,2025-146892 PP,9624 BREEZE HILL DR,*Green Building* New 2-story 4 bedroom 4.5 bathroom single family residence with attached garage covered front porch and rear covered patio.
2025-12-08T00:00:00.000,Austin,Building Permit,2025-140952 BP,4700 HAWKHAVEN LN,Express- Replace 3 windows like for like
2025-12-08T00:00:00.000,Austin,Mechanical Permit,2025-153246 MP,5700 WESTVIEW RD,Replacement of complete existing central heat and air system with or without duct work SUSIE BULLION
2025-12-08T00:00:00.000,Austin,Mechanical Permit,2025-149648 MP,1600 W 38TH ST UNIT 201,Interior Renovation of two existing suites to create one new medical office.
2025-12-08T00:00:00.000,Austin,Plumbing Permit,2025-154423 PP,1071 SPRINGDALE RD,This permit is for a 3 compartment sink that was previously installed by someone else. Not a new sink. The health inspector came by the business and relayed to the owner that the sink would need a permit and inspection. I applied for this permit on Nov. 21 and it was rejected. The employee that rejected it said we needed a commercial plan review.  The owner went in and spoke to a reviewer while the application was still incomplete the reviewer said we didnt need a plan review and requires photos and a line diagram uploaded to the incomplete permit. I withdrew the incomplete application last night. So this is the reason for a new permit application at this address.
