date,city,permit_type,permit_number,address,description
2025-11-17T00:00:00.000,Austin,Plumbing Permit,2025-082759 PP,10007 BRIGHTLING LN,Replacement of an existing water heater
2025-11-17T00:00:00.000,Austin,Electrical Permit,2025-145641 EP,1104 WINIFRED DR,Power for EV NEMA 14-50 outlet
2025-11-17T00:00:00.000,Austin,Plumbing Permit,2025-147039 PP,2809 ALSATIA DR,Replacement of an existing water heater Pedro Martinez - Install gas water heater like for like - tank type
2025-11-17T00:00:00.000,Austin,Building Permit,2025-146300 BP,1112 W BEN WHITE BLVD SVRD WB,APPROX. 2400 SF OF LEVEL 1 INTERIOR RENOVATIONS. SCOPE INCLUDES PAINTING OF EXTERIOR PLASTER.
2025-11-17T00:00:00.000,Austin,Mechanical Permit,2025-076363 MP,3905 CONFERENCE CV,New single-family residence with attached garage
2025-11-17T00:00:00.000,Austin,Plumbing Permit,2025-146339 PP,8350 W US 290 HWY,Irrigation system installation
2025-11-17T00:00:00.000,Austin,Electrical Permit,2025-146467 EP,14118 EDNA MAXINE WALK,New Service for SFR in ETJ
2025-11-17T00:00:00.000,Austin,Electrical Permit,2025-145155 EP,8700 BASIL HAYDEN LN,temporary tpole for new construction in Easton Park Ref: 2025-106952-BP
2025-11-17T00:00:00.000,Austin,Building Permit,2025-145458 BP,12515 FALLEN TOWER LN,Express- Foundation Repair on a slab foundation. Install 18 total press piling pier locations along the perimeter. There will be 2 breakthrough and patched locations. We will improve level to the extent.
2025-11-17T00:00:00.000,Austin,Plumbing Permit,2025-146182 PP,7206 ED BLUESTEIN BLVD SB,Replace RPZ for drive thru soda fountain (KFC)
2025-11-17T00:00:00.000,Austin,Electrical Permit,2025-077584 EP,1013 MONTOPOLIS DR,Affordability Unlocked and Smart Housing development. 150 unit 4 story elevator served multifamily apartment. Project is one 130651sf multifamily building with tenant amenities on the first floor.   PuPR2
2025-11-17T00:00:00.000,Austin,Building Permit,2025-147669 BP,2707 BOBBY LN,Express: Replace siding on right side of home 550 sq.ft.
2025-11-17T00:00:00.000,Austin,Electrical Permit,2025-146074 EP,2602 TOWY RD,Homebuilder Loop Austin 2 Mile ETJ Austin Energy
2025-11-17T00:00:00.000,Austin,Plumbing Permit,2025-147398 PP,1115 SHADY LN,Installation on the onsite underground fire line piping.  SP-2019-0257C
2025-11-17T00:00:00.000,Austin,Electrical Permit,2025-145162 EP,6207 ARNOLD DR BLDG A,Install new 3.44 kW DC rooftop solar system to existing residential
2025-11-17T00:00:00.000,Austin,Building Permit,2025-146398 BP,5219 MONARDA MINT DR,Coolidge 1027-K-R New 2-Story Single Family Residence with (4) bedrooms (3) bathrooms Attached Garage Covered Patio & Porch Cafe & Loft
2025-11-17T00:00:00.000,Austin,Electrical Permit,2025-135589 EP,10258 1/2 OLD LOCKHART RD UNIT TEMP3,ETJ - temp power
2025-11-17T00:00:00.000,Austin,Electrical Permit,2025-145581 EP,4604 CRESTWAY DR,install home standby generator
2025-11-17T00:00:00.000,Austin,Building Permit,2025-145478 BP,8201 E RIVERSIDE DR BLDG 6 UNIT 650,Interior Non-Structural demolition
2025-11-17T00:00:00.000,Austin,Plumbing Permit,2025-147704 PP,3600 BREAKTHROUGH LOOP,Outside Underground Water and Wastewater with Storm.  Please link along with 2025-147385 PP to the Parent Building Permit 2024-151056 BP.
2025-11-17T00:00:00.000,Austin,Driveway / Sidewalks,2025-135603 DS,8205 SANDALWOOD CV,Demo old driveway.  Construct new driveway approach of 11 FT and curb & gutter of 19 FT.
2025-11-17T00:00:00.000,Austin,Mechanical Permit,2025-144664 MP,7603 PARKVIEW CIR,Replacement of complete existing central heat and air system with or without duct work LIKE FOR LIKE: 4 Ton Two Stage Horizontal Gas System
2025-11-17T00:00:00.000,Austin,Electrical Permit,2025-146825 EP,1117 ARTHUR STILES RD,Need electrical permit to Upgrade the electrical service
2025-11-17T00:00:00.000,Austin,Electrical Permit,2025-144970 EP,4108 N LAMAR BLVD,BENTLEY: Install (1) wall sign
2025-11-17T00:00:00.000,Austin,Building Permit,2025-145996 BP,2303 E 2ND ST BLDG 2,2303 E 2nd St Building 2: (rearmost on Mildred side): New construction of a 3-Story Single Family Res. [3 bed 3.5bath] with Attached 1-car Garage and 3rd floor balcony. Part of 4-unit use 8 detached units total in development across 2 lots.
2025-11-17T00:00:00.000,Austin,Plumbing Permit,2025-145485 PP,3524 GONZALES ST UNIT 2B,Installing a new irrigation system
2025-11-17T00:00:00.000,Austin,Electrical Permit,2025-145655 EP,4907 WHITETHORN CT,Install new 16.10 kW DC rooftop solar system to new residential
2025-11-17T00:00:00.000,Austin,Plumbing Permit,2025-146895 PP,4800 BROKEN BOW PASS,Had to move gas line 4 feet to new location of range in the kitchen  LS 11/18/25 EDIT New copper supply lines added. Full Plumbing final inspection of kitchen remodel required. All fixtures and devices required to be installed.
2025-11-17T00:00:00.000,Austin,Building Permit,2025-146455 BP,5400 WATERBROOK DR,EXPRESS: During re-roof process need to re-deck the house since the current decking is out of code
2025-11-17T00:00:00.000,Austin,Electrical Permit,2025-120838 EP,2310 VILLAGE CIR BLDG 2,Bldg #2: New 1-story detached dwelling unit 1 bed/1 bath
2025-11-17T00:00:00.000,Austin,Building Permit,2025-143778 BP,625 E 10TH ST UNIT 1000,ePlan: Commercial Expedited Review - Remodel to Existing 10th Floor Areas (12835 SF).
2025-11-17T00:00:00.000,Austin,Plumbing Permit,2025-129922 PP,5013 TRADING BND,Express: Replace cabinets in kitchen and 2 bathrooms replace plumbing and electrical fixtures like for like add electrical outlet for microwave install new appliances retile of master shower walls and floor interior painting
2025-11-17T00:00:00.000,Austin,Mechanical Permit,2025-145133 MP,4618 YELLOW ROSE TRL,Replacement of complete existing central heat and air system with or without duct work LIKE FOR LIKE: 3.5 Ton Vertical Gas System
2025-11-17T00:00:00.000,Austin,Plumbing Permit,2025-114995 PP,20 MARGRANITA CRES,1-story addition/interior remodel to existing single family residence extending dining room adding 1 bath  and uncovered deck
2025-11-17T00:00:00.000,Austin,Electrical Permit,2025-146184 EP,12624 TIMBER HEIGHTS DR,Install new 5.7kW rooftop solar system to existing residential only using line side tap.
2025-11-17T00:00:00.000,Austin,Electrical Permit,2025-131796 EP,7010 W SH 71 UNIT 250,TI Retail to Retail - Remodeling an existing empty unit into a pool showroom.
2025-11-17T00:00:00.000,Austin,Mechanical Permit,2025-146393 MP,532 CELERY LOOP,Replacement of complete existing central heat and air system with or without duct work
2025-11-17T00:00:00.000,Austin,Electrical Permit,2025-144109 EP,11515 BURNET RD BLDG FLR7,Interior remodel existing 7th floor common areas.
2025-11-17T00:00:00.000,Austin,Building Permit,2025-145804 BP,1517 MAIER DR,Express- conduct fire remediation including: electrical framing roofing drywall flooring and insulation. Studs around back door need to be replaced. some truces need to be reinforced )not rebuilt) some drywall in master bedroom need to be replaced and some misc patches. Back door and 1 window need replaced. A couple of outlets and light fixtures need replacement
2025-11-17T00:00:00.000,Austin,Plumbing Permit,2025-146446 PP,1211 FAIRWOOD RD,repair gas lines and test for restoration of services.
2025-11-17T00:00:00.000,Austin,Plumbing Permit,2025-145479 PP,3524 GONZALES ST UNIT 1B,Installing a new irrigation system
2025-11-17T00:00:00.000,Austin,Plumbing Permit,2025-070533 PP,1403 W 30TH ST,Addition/remodel. Addition of 145 sf to existing noncomplying 1-story single family residence for the expansion of existing primary bathroom and closet with addition of new storage area. Remodel guest bath. Add half bath and bar area to existing family room. Remodel screen porch. Addition/remodel will result in a 2 bedroom 2.5 bathroom single family residence.
2025-11-17T00:00:00.000,Austin,Building Permit,2025-147521 BP,2801 SAN JACINTO BLVD,2025/11/22 & 2025/11/28 | Arkansas Tailgate 11/22 and A&M Tailgate 11/28 getting a band extra parking lot space with possible port-o-potties along with possible food truck.  #Greek
2025-11-17T00:00:00.000,Austin,Building Permit,2025-144698 BP,3435 PARKER LN,Flat Roof Solar Installation of 305 solar panels. System will include 2 Solis Inverters
2025-11-17T00:00:00.000,Austin,Mechanical Permit,2025-075342 MP,2703 WHITE HORSE TRL,ePlan: Residential Expedited Review - New TWO UNIT RES. Bldg 1 New construction of a 2-Story Single Family Res. [5bed 5.5bath] with Attached Garage
2025-11-17T00:00:00.000,Austin,Plumbing Permit,2025-146943 PP,14120 AXEL JOHANSON DR,New Service for SFR in ETJ. 2350 sq ft.
2025-11-17T00:00:00.000,Austin,Electrical Permit,2025-135592 EP,10258 1/2 OLD LOCKHART RD UNIT TEMP4,ETJ - temp power
2025-11-17T00:00:00.000,Austin,Building Permit,2025-147252 BP,9111 CIRCUIT OF THE AMERICAS BLVD,TEMPORARY BUILDING PERMIT scope of permit is limited to foundation and under slab utilities for MF 8 restrooms/stroller rental (BPEPPP) to be issued.
2025-11-17T00:00:00.000,Austin,Plumbing Permit,2025-146324 PP,3524 GONZALES ST UNIT 2A,Installing a new irrigation system
2025-11-17T00:00:00.000,Austin,Plumbing Permit,2025-145588 PP,4604 CRESTWAY DR,gas work for home standby generator
2025-11-17T00:00:00.000,Austin,Building Permit,2025-146970 BP,12917 STAYWELL WAY,1702BR NEW 1 STORY 4 BEDROOM 2 BATH SINGLE FAMILY RESIDENTIAL HOME WITH ATTACHED GARAGE COVERED FRONT PORCH
2025-11-17T00:00:00.000,Austin,Electrical Permit,2025-143100 EP,2737 WEBBERVILLE RD--BLDG 1--EVSE,Install EV charger only. No other work to be performed
2025-11-17T00:00:00.000,Austin,Driveway / Sidewalks,2025-145822 DS,4808 RICHMOND AVE BLDG 2,Construct new driveway approach 12 FT and Curb and Gutter of 20 FT.  Fee in lieu of sidewalk paid.
2025-11-17T00:00:00.000,Austin,Plumbing Permit,2025-145511 PP,3528 GONZALES ST UNIT 1A,Installing a new irrigation system
2025-11-17T00:00:00.000,Austin,Mechanical Permit,2025-142755 MP,6310 TREADWELL BLVD BLDG C,Replacement of any self-contained packaged units RTU Replacement on Cafeteria
2025-11-17T00:00:00.000,Austin,Building Permit,2025-147737 BP,2505 DEERFOOT TRL,ePlan: Residential Expedited Review - New pool and spa
2025-11-17T00:00:00.000,Austin,Mechanical Permit,2025-142204 MP,8301 JOHNNY MORRIS RD BLDG 2,ePlan: Commercial Expedited Review - New Construction of Office Building - Operations.
2025-11-17T00:00:00.000,Austin,Electrical Permit,2025-145981 EP,3505 WEST AVE,Upgrade the main service to a 200-amp main breaker 200-amp AE metercan grounding and surge protection
2025-11-17T00:00:00.000,Austin,Plumbing Permit,2025-146083 PP,5245 W US 290 HWY SVRD EB,Replacement of a large format analyzer requiring demolition of a wall and the installation of temporary electrical power data ports and floor sink. The HVAC will be rebalanced
2025-11-17T00:00:00.000,Austin,Plumbing Permit,2025-143795 PP,14025 AXEL JOHANSON DR,New construction sfr in the etj 1950sqft
2025-11-17T00:00:00.000,Austin,Plumbing Permit,2025-144521 PP,3103 GARWOOD ST BLDG 2,ePlan: Residential Expedited Review - New THREE UNIT RES. Bldg 2 New construction of a 2-Story Single Family Res. [3bed 2.5bath] with Attached Garage
2025-11-17T00:00:00.000,Austin,Mechanical Permit,2025-133484 MP,8 OLMOS DR,Move and set new mobile home base pad all hookupsdeck and skirting HM1080 Sqft 2 4x4 decks 16 sqft each
2025-11-17T00:00:00.000,Austin,Electrical Permit,2025-146188 EP,10103 ALCOTT CV,ev install
2025-11-17T00:00:00.000,Austin,Electrical Permit,2023-153474 EP,2901 S CAPITAL OF TEXAS HWY NB UNIT A02A,Change of Use from Personal Services to Retail and Interior Remodel of Existing Tenant Space in Barton Creek Square Mall - Suite A02A
2025-11-17T00:00:00.000,Austin,Plumbing Permit,2025-145586 PP,4210 VENADO DR,gas work for home standby generator
2025-11-17T00:00:00.000,Austin,Electrical Permit,2025-145532 EP,5512 COVENTRY LN,Request to disconnect extending conductors above the main breaker for line side tap in existing 125A panel no new meter can required
2025-11-17T00:00:00.000,Austin,Plumbing Permit,2025-138873 PP,1901 MADISON AVE,ePlan: Residential Expedited Review - New construction of a 2-Story Single Family Res. [4bed 4bath] with Habitable Attic Attached Garage
2025-11-17T00:00:00.000,Austin,Electrical Permit,2025-135594 EP,10258 1/2 OLD LOCKHART RD UNIT TEMP6,ETJ - temp power
2025-11-17T00:00:00.000,Austin,Building Permit,2025-145995 BP,2303 E 2ND ST BLDG 3,2303 E 2nd St BUILDING 3 (middle rear on Mildred side):   New construction of a 3-Story Single Family Res. [3 bed 3.5bath] and 3rd floor balcony. Part of 4-unit use 8 detached units total in development across 2 lots.
2025-11-17T00:00:00.000,Austin,Plumbing Permit,2025-138874 PP,1901 MADISON AVE,New pool and spa
2025-11-17T00:00:00.000,Austin,Electrical Permit,2025-140250 EP,4330 AIRPORT BLVD,Tpole ref: 2025 090933 BP
2025-11-17T00:00:00.000,Austin,Electrical Permit,2025-136691 EP,1806 PRINCETON AVE,ePlan: Residential Expedited Review - New construction of a Detached Garage containing unfinished Habitable Attic [LDC 3.3.3(C)]
2025-11-17T00:00:00.000,Austin,Building Permit,2025-143232 BP,2103 TOWER DR,Total demo of SFR 1726 sq ft circa 1947   ***The building shall not be demolished until after the contractor has fulfilled the neighbor notification requirements outlined in Steps 5 & 6 of the Demolition webpage.***
2025-11-17T00:00:00.000,Austin,Driveway / Sidewalks,2025-138021 DS,2301 E 2ND ST,Construct new driveway approach of 12 FT
2025-11-17T00:00:00.000,Austin,Plumbing Permit,2025-141592 PP,1180 RIDGEWAY DR--UNIT 2,ePlan: Residential Expedited Review - New construction of Second Unit. [3bed 3bath]. Existing 1-Story Single Family Res to remain as is.
2025-11-17T00:00:00.000,Austin,Building Permit,2025-147735 BP,2505 DEERFOOT TRL,ePlan: Residential Expedited Review - New construction of a 2-Story Single Family Res. [5bed 4bath] with Attached Garage.  Work to include Casita (1bed/ 1 bath) connected by breeze way.
2025-11-17T00:00:00.000,Austin,Electrical Permit,2025-135597 EP,10258 1/2 OLD LOCKHART RD UNIT TEMP9,ETJ - temp power
2025-11-17T00:00:00.000,Austin,Plumbing Permit,2025-147376 PP,8113 APPOMATTOX DR,EXPRESS: Tub to shower conversion in hallway bathroom  Upgrade electrical service panel Replace HVAC system
2025-11-17T00:00:00.000,Austin,Plumbing Permit,2025-099824 PP,6231 E STASSNEY LN BLDG 12 UNIT 103,Interior remodel- expand office warehouse tenant into adjacent space.
2025-11-17T00:00:00.000,Austin,Plumbing Permit,2025-143739 PP,14116 EDNA MAXINE WALK,New construction sfr in the etj 2278sqft
2025-11-17T00:00:00.000,Austin,Mechanical Permit,2025-146993 MP,1102 LORRAIN ST,Replacement of complete existing central heat and air system with or without duct work Yasser Nasser: Replacement of 3T horizontal like-for-like gas system
2025-11-17T00:00:00.000,Austin,Electrical Permit,2025-146253 EP,14021 AXEL JOHANSON DR,New Service for SFR in ETJ
2025-11-17T00:00:00.000,Austin,Electrical Permit,2025-146631 EP,8500 ENDALE ARCH DR,temporary tpole for new construction for Easton Park
2025-11-17T00:00:00.000,Austin,Building Permit,2025-145486 BP,2105 MONARCH DR,express- foundation repair on a slab foundation. Install 16 press piling pier locations along the perimeter. There will be 4 breakthrough and patched locations. Improve level to the extent.
2025-11-17T00:00:00.000,Austin,Electrical Permit,2025-135593 EP,10258 1/2 OLD LOCKHART RD UNIT TEMP5,ETJ - temp power
2025-11-17T00:00:00.000,Austin,Electrical Permit,2025-146353 EP,14122 EDNA MAXINE WALK,New Service for SFR in ETJ
2025-11-17T00:00:00.000,Austin,Mechanical Permit,2025-145616 MP,3513 LAKELAND DR,Replacement of complete existing central heat and air system with or without duct work LIKE FOR LIKE: 3 Ton Two Stage Vertical Gas System
2025-11-17T00:00:00.000,Austin,Mechanical Permit,2025-103439 MP,8500 HANBRIDGE LN,NEW CONSTRUCTION 2-STORY SINGLE FAMILY RESIDENCE. EXISTING HOME BURNED DOWN IN FIRE. SEE 2025-047680 PR
2025-11-17T00:00:00.000,Austin,Mechanical Permit,2025-145132 MP,500 SUNRISE CIR,Replacement of complete existing central heat and air system with or without duct work LIKE FOR LIKE: 2 Ton Vertical Gas System
2025-11-17T00:00:00.000,Austin,Mechanical Permit,2025-142203 MP,8301 JOHNNY MORRIS RD BLDG 1,ePlan: Commercial Expedited Review - New Construction of Office Building - Administration.
2025-11-17T00:00:00.000,Austin,Electrical Permit,2025-146532 EP,4703 CARSONHILL DR,I would like to install an 11.44 kW solar array with a Tesla Powerwall 3 battery inverter on a Tesla meter socket and a new SPAN service panel. This installation will require a meter upgrade.
2025-11-17T00:00:00.000,Austin,Mechanical Permit,2025-146015 MP,6816 BARSTOW CT,Replacement of complete existing central heat and air system with or without duct work Replace unit and thermostat. Bring everything up to code blow drain line. 1 for 1 unit swap
2025-11-17T00:00:00.000,Austin,Mechanical Permit,2025-085024 MP,1519 CORONADO HILLS DR,ePlan: Commercial Expedited Review - [Public Project] Interior Remodel to Existing CTE Campus including 2 New Secured Enty Vestibules Remodel Admin Space New Culinary Dining and Cosmetology Education Programs And Roof Modifications. (33583 SF)
2025-11-17T00:00:00.000,Austin,Plumbing Permit,2025-143723 PP,12000 MURANO DR,New construction sfr in the etj 2370sqft
2025-11-17T00:00:00.000,Austin,Building Permit,2025-143173 BP,2701 S LAMAR BLVD,AT&T Proposes to - Tower SOW- Remove: (3) B66 RRUs (3) B2/B66 RRUs (3) E15Z01P13 TMAS 50A Coax. Relocate: (3) Air Antennas (3) RRUs. Install: (3) B77G Air Antennas (3) B25/B66 Radios Installation of mount modifications will be per plans. Ground SOW - Install: (6) 50A DC Breakers in existing DC power plant
2025-11-17T00:00:00.000,Austin,Electrical Permit,2025-145273 EP,3502 PENNSYLVANIA AVE--BLDG 2,Install GFCI-protected 50-amp outlet for an electric vehicle. Conduit ran from the main panel to evc outlet on the outside of the house.
2025-11-17T00:00:00.000,Austin,Building Permit,2025-143777 BP,625 E 10TH ST UNIT 200,ePlan: Commercial Expedited Review - Remodel to Existing 2nd Floor Areas (587 SF).
2025-11-17T00:00:00.000,Austin,Electrical Permit,2025-146643 EP,7102 LANGSTON DR,Upgrading Main Service to 200 amps
2025-11-17T00:00:00.000,Austin,Plumbing Permit,2025-146166 PP,707 W OLTORF ST,set 1 toilet and install 3 hose bibs
2025-11-17T00:00:00.000,Austin,Electrical Permit,2025-144640 EP,1204 SINGLETON AVE,temporary pole for construction site Ref: 2025-137191-BP 2025-137193-BP
2025-11-17T00:00:00.000,Austin,Electrical Permit,2025-138623 EP,12500 DESCANSO CIR,connect mobile home and add deck 4x4 and 8x8
2025-11-17T00:00:00.000,Austin,Plumbing Permit,2025-147770 PP,5801 EUREKA DR,EXPRESS: Replace water heater/ tub to shower
2025-11-17T00:00:00.000,Austin,Building Permit,2025-146639 BP,2707 WHITE HORSE TRL,Total Demo of SFR 994 sqft circa 1952 Total Demo of Detached Garage 288 sqft  ***The building shall not be demolished until after the contractor has fulfilled the neighbor notification requirements outlined in Steps 5 & 6 of the Demolition webpage.***
2025-11-17T00:00:00.000,Austin,Building Permit,2025-139506 BP,4211 S LAMAR BLVD NB BLDG A UNIT 9,CHANGE OF USE from Personal Services to Limited Warehouses and Distribution and Installation of roll down security shutters over the glass door and windows for A-9
2025-11-17T00:00:00.000,Austin,Electrical Permit,2025-145617 EP,2903 HILLVIEW RD Unit 1,Interior Remodel  addition to existing residence new detached garage with dwelling unit above
2025-11-17T00:00:00.000,Austin,Electrical Permit,2025-145574 EP,1309 BENTWOOD RD,install home standby generator
2025-11-17T00:00:00.000,Austin,Driveway / Sidewalks,2024-141742 DS,4808 RICHMOND AVE BLDG 1,Construct new driveway approach 12 FT and 26 FT Curb & Gutter.  Fee in lieu of sidewalk paid.
2025-11-17T00:00:00.000,Austin,Electrical Permit,2025-135055 EP,5701 GLENHOLLOW PATH,PARTIAL CARPORT ENCLOSURE AND INTERIOR REMODEL
2025-11-17T00:00:00.000,Austin,Electrical Permit,2025-099824 EP,6231 E STASSNEY LN BLDG 12 UNIT 103,Interior remodel- expand office warehouse tenant into adjacent space.
2025-11-17T00:00:00.000,Austin,Plumbing Permit,2025-129889 PP,4702 SANTA ANNA ST,Addition - Bathroom addition  bathroom addition with outdoor shower. rolling in expired permit 2023-123109 BP 2023-123109 EP and 2023123109 PP
2025-11-17T00:00:00.000,Austin,Building Permit,2025-144406 BP,15108 CALAVERAS DR,This project involves the remodel of an existing bathroom within an occupied structure. The total scope is confined to a clearly defined interior area and does not include work in the adjacent areas marked as NOT IN SCOPE on the provided plans. The remodel includes interior upgrades to plumbing fixtures partitions finishes and select building systems. This project is part of a 205 sq. ft. interior renovation focused on improving functionality accessibility and compliance with applicable codes (plumbing ADA etc.)
2025-11-17T00:00:00.000,Austin,Building Permit,2025-146654 BP,2707 WHITE HORSE TRL,Total Demo of SFR 994 sqft circa 1952 Total Demo of Detached Garage 288 sqft  ***The building shall not be demolished until after the contractor has fulfilled the neighbor notification requirements outlined in Steps 5 & 6 of the Demolition webpage.***
2025-11-17T00:00:00.000,Austin,Building Permit,2025-140455 BP,6107 CADDIE ST,Total demo of 1116 sqft SFR circa 1962
2025-11-17T00:00:00.000,Austin,Plumbing Permit,2024-143036 PP,1004 WALTER ST--POOL,New construction in-ground pool.
2025-11-17T00:00:00.000,Austin,Electrical Permit,2025-131837 EP,6312 ANTIGO LN,Construction of gunite swimming pool concrete flatwork  remove 70 sf of existing IC
2025-11-17T00:00:00.000,Austin,Building Permit,2025-142848 BP,1618 E RIVERSIDE DR,New outdoor patio for an existing restaurant
2025-11-17T00:00:00.000,Austin,Driveway / Sidewalks,2025-130495 DS,4705 DEPEW AVE,Construct new driveway approach of 12 FT 30 LF of sidewalk and 17FT 3/4IN Curb and Gutter.
2025-11-17T00:00:00.000,Austin,Building Permit,2025-145327 BP,1302 DELANO ST UNIT B,Express: Foundation repair
2025-11-17T00:00:00.000,Austin,Electrical Permit,2025-146360 EP,4505 SARASOTA DR,Wilkerson 39-09320: Disconnect/reconnect power to tie in PV component and upgrading MSP to 200 Amps. 200a Main Breaker. Also upgrading revenue meter to 200 Amps.
2025-11-17T00:00:00.000,Austin,Building Permit,2025-146083 BP,5245 W US 290 HWY SVRD EB,Replacement of a large format analyzer requiring demolition of a wall and the installation of temporary electrical power data ports and floor sink. The HVAC will be rebalanced
2025-11-17T00:00:00.000,Austin,Plumbing Permit,2025-143703 PP,12024 ELLENA CV,New construction sfr in the etj 1994 sqft
2025-11-17T00:00:00.000,Austin,Building Permit,2025-138952 BP,400 W 15TH ST UNIT 1000,Interior alteration of existing offices and corridor spaces on Levels 8 10 11 12  (4) Applications
2025-11-17T00:00:00.000,Austin,Plumbing Permit,2025-145045 PP,3901 CONFERENCE CV,Tunnel under home about 20ft to replace drain line with schedule 40 PVC. Also will repair part of the yard drain line where there is a root intrusion and replace homeowner shut off valve. **main sewer line  NO TUNNEL JOB DONE ONLY YARD LINE
2025-11-17T00:00:00.000,Austin,Electrical Permit,2025-135595 EP,10258 1/2 OLD LOCKHART RD UNIT TEMP7,ETJ - temp power
2025-11-17T00:00:00.000,Austin,Building Permit,2025-146447 BP,5115 1/2 BOLM RD UNIT C,Upgrade antennas on existing wireless telecommunications facility - no backup batteries or generator proposed.
2025-11-17T00:00:00.000,Austin,Plumbing Permit,2025-120786 PP,604 BRAZOS ST,ePlan: Commercial Expedited Review - [AE GREEN BUILDING] Interior Remodel to Existing Hotel. Work to include Remodel of 65 guestrooms and corridors (175 000 SF)
2025-11-17T00:00:00.000,Austin,Mechanical Permit,2025-130248 MP,30 ESPINOSA DR,connect mobile home and add deck 4x4
2025-11-17T00:00:00.000,Austin,Plumbing Permit,2025-145969 PP,2013 VERBENA DR,Replacement of an existing water heater 1 for 1 WH Swap out.
2025-11-17T00:00:00.000,Austin,Plumbing Permit,2025-146970 PP,12917 STAYWELL WAY,1702BR NEW 1 STORY 4 BEDROOM 2 BATH SINGLE FAMILY RESIDENTIAL HOME WITH ATTACHED GARAGE COVERED FRONT PORCH
2025-11-17T00:00:00.000,Austin,Electrical Permit,2025-146256 EP,4505 SARASOTA DR,Install new 5.7kW rooftop solar system to existing residential only using backfed breaker.
2025-11-17T00:00:00.000,Austin,Electrical Permit,2025-103750 EP,4607 CACTUS LN,New construction of gunite swimming pool
2025-11-17T00:00:00.000,Austin,Plumbing Permit,2025-147041 PP,803 TIRADO ST,Repair to damaged gas line on exterior of building
2025-11-17T00:00:00.000,Austin,Building Permit,2025-138951 BP,400 W 15TH ST UNIT 804,Interior alteration of existing offices and corridor spaces on Levels 8 10 11 12  (4) Applications
2025-11-17T00:00:00.000,Austin,Building Permit,2024-131062 BP,6034 WEST COURTYARD DR UNIT 224,Add demising wall return to office shell.
2025-11-17T00:00:00.000,Austin,Electrical Permit,2025-142287 EP,4205 AVENUE F,ev install
2025-11-17T00:00:00.000,Austin,Mechanical Permit,2025-135522 MP,8001 JOHNNY MORRIS RD BLDG 2,ePlan: Commercial Expedited Review - New Construction of 5 Service Center Bldgs. New Building - Public Safety Service Center - Business & Customer Service Space and Service Center for Heavy Duty Vehicles.
2025-11-17T00:00:00.000,Austin,Mechanical Permit,2025-134233 MP,5701 SPRINGDALE RD,Replacement of any self-contained packaged units Replacement of the only chiller for the Education Service Center
2025-11-17T00:00:00.000,Austin,Electrical Permit,2025-145164 EP,6207 ARNOLD DR BLDG B,Install new 3.01 kW DC rooftop solar system to existing residential
2025-11-17T00:00:00.000,Austin,Building Permit,2025-147405 BP,3611 ARROWHEAD DR,Express: Replacing 9 windows
